{
  "$schema": "https://json-schema.org/draft/2020-12/schema",
  "$id": "https://wos-spec.org/schemas/studio-migration-path/1.0",
  "title": "WOS Studio (Authoring) — Migration Path",
  "description": "MigrationPath records the wosVersionPin claim string for a WorkflowIntent + tracks deprecation alerts + the chosen migration strategy when the parent stack ratifies a new minor stream version. Per studio/specs/compiler-contract.md SA-MUST-cmp-050-052 + change-impact.md `triggerKind = wos-version-deprecation`. Composes parent RELEASE-STREAMS.md + COMPATIBILITY-MATRIX.md versioning model.",
  "$comment": "Promotion status (Stage-3, 2026-05-01): MVP shape; deprecationAlerts[] surface from parent compatibility matrix at re-compile time.",
  "type": "object",
  "required": ["$wosStudioMigrationPath", "id", "workspaceId", "wosVersionPin"],
  "additionalProperties": false,
  "patternProperties": { "^(\\$|x-)": {} },
  "properties": {
    "$wosStudioMigrationPath": {
      "type": "string",
      "const": "1.0",
      "description": "Document marker.",
      "examples": ["1.0"],
      "x-lm": {
        "critical": true,
        "intent": "Document type marker for the Studio MigrationPath"
      }
    },
    "id": {
      "type": "string",
      "examples": ["mig-snap-redet-tx-v1.0.0"]
    },
    "workspaceId": { "type": "string" },
    "workflowIntentRef": {
      "type": "string",
      "description": "WorkflowIntent this MigrationPath applies to."
    },
    "wosVersionPin": {
      "type": "string",
      "description": "WOS version claim string per parent RELEASE-STREAMS.md. Comma-separated stream@version pairs.",
      "examples": ["kernel@1.0, governance@1.0, ai@0.5, signature@1.0, custody@1.0, advanced@0.3, assurance@1.0"],
      "x-lm": {
        "critical": true,
        "intent": "WOS substrate version pin — load-bearing for reproducibility and migration triggering"
      }
    },
    "pinnedAt": {
      "type": "string",
      "format": "date-time",
      "description": "When the pin was set."
    },
    "deprecationAlerts": {
      "type": "array",
      "description": "Active deprecation alerts (from parent COMPATIBILITY-MATRIX.md re-resolution at compile time).",
      "items": {
        "type": "object",
        "properties": {
          "stream": { "type": "string", "examples": ["wos-ai"] },
          "currentVersion": { "type": "string", "examples": ["0.5"] },
          "deprecatedAt": { "type": "string", "format": "date-time" },
          "supersedingVersion": { "type": "string", "examples": ["1.0"] },
          "migrationGuidance": { "type": "string" }
        }
      }
    },
    "migrationStrategy": {
      "type": "string",
      "enum": ["regenerate", "preserve", "manual-review"],
      "description": "Chosen migration approach. `regenerate` = re-compile from current PolicyObjects against the new pin; `preserve` = keep at old pin until end-of-support; `manual-review` = reviewer walk-through required before re-pinning."
    },
    "lastMigratedAt": {
      "type": ["string", "null"],
      "format": "date-time"
    }
  }
}
