{
  "$wosStudioMigrationPath": "1.0",
  "id": "mig-snap-redet-tx-v1.0.0",
  "workspaceId": "ws-snap-redetermination-tx-2026",
  "workflowIntentRef": "wfi-snap-redetermination-tx",
  "wosVersionPin": "kernel@1.0, governance@1.0, ai@0.5, signature@1.0, custody@1.0, advanced@0.3, assurance@1.0",
  "pinnedAt": "2026-04-25T15:30:00Z",
  "deprecationAlerts": [],
  "migrationStrategy": "regenerate",
  "lastMigratedAt": null
}
